rank,ticker,company_name,ai_score,sentiment,recommendation,catalysts,risks,certainty,articles_count,quant_alpha,headline,reasoning
1,CAMS,COMPUTER AGE MANAGEMENT SERVICES LIMITED,86.8,bullish,STRONG BUY,"earnings, investment, expansion",,90,1,63.6,CAMS shares fall 7% as Q2 profit dips 6% YoY despite record revenue ,Detected 3 catalyst(s). From economictimes.indiatimes.com. Score: 100/100. Certainty: 90%. BULLISH.
2,FOCUS,FOCUS LIGHTING AND FIXTURES LIMITED,85.6,bullish,STRONG BUY,"earnings, investment, expansion",,88,4,41.8,Tata Capital shares in focus after Q2 net profit rises 2% YoY ,Detected 3 catalyst(s). From economictimes.indiatimes.com. Score: 100/100. Certainty: 88%. BULLISH.
3,DCM,DCM  LIMITED,83.7,bullish,STRONG BUY,"earnings, m&a, investment, expansion, dividend",,95,1,47.6,DCM Shriram shares rally 8% as Q2 net profit jumps 153% to Rs 159 crore ,Detected 5 catalyst(s). From economictimes.indiatimes.com. Score: 100/100. Certainty: 95%. BULLISH.
4,WORTH,WORTH PERIPHERALS LIMITED,77.6,bullish,BUY,"earnings, investment, expansion",,48,1,53.5,Aditya Birla Capital shares in focus as Advent exits entire 2% stake worth Rs 16.4 billion ,Detected 3 catalyst(s). From economictimes.indiatimes.com. Score: 100/100. Certainty: 48%. BULLISH.
5,TAKE,TAKE SOLUTIONS LIMITED,75.7,bullish,BUY,"earnings, investment, expansion",,48,1,73.6,India’s IPO frenzy hits $200 million an hour as retail investors take charge,Detected 3 catalyst(s). From www.thehindubusinessline.com. Score: 100/100. Certainty: 48%. BULLISH.
6,RETAIL,JHS SVENDGAARD RETAIL VENTURES LIMITED,72.6,bullish,BUY,"earnings, investment, expansion",,48,1,38.2,India’s IPO frenzy hits $200 million an hour as retail investors take charge,Detected 3 catalyst(s). From www.thehindubusinessline.com. Score: 100/100. Certainty: 48%. BULLISH.
7,SIGNATURE,SIGNATUREGLOBAL (INDIA) LIMITED,70.4,neutral,STRONG BUY,"investment, contract",Debt,92,1,43.4,Signature Global secures  ₹8.75 billion via NCDs for sustainable housing projects,Detected 2 catalyst(s). From www.livemint.com. Score: 87/100. Certainty: 92%. NEUTRAL.
8,RACE,RACE ECO CHAIN LIMITED,55.2,bullish,BUY,expansion,,76,1,38.5,"Jio tops race with 50 crore total subscribers, BSNL outpaces Airtel; Vi loses 7 lakh users: TRAI rep",Detected 1 catalyst(s). From www.livemint.com. Score: 66/100. Certainty: 76%. BULLISH.
9,MRPL,MANGALORE REFINERY AND PETROCHEMICALS LIMITED,44.7,bullish,HOLD,,,55,1,70.9,Stock to buy today: MRPL (₹152.90) – BUY,Detected 0 catalyst(s). From www.thehindubusinessline.com. Score: 51/100. Certainty: 55%. BULLISH.
