rank,ticker,company_name,ai_score,sentiment,recommendation,catalysts,risks,certainty,articles_count,quant_alpha,current_price,price_timestamp,entry_zone_low,entry_zone_high,target_conservative,target_aggressive,stop_loss,fundamental_adjustment,quarterly_earnings_growth_yoy,annual_earnings_growth_yoy,profit_margin_pct,debt_to_equity,is_profitable,net_worth_positive,financial_health_status,health_is_profitable,health_profit_loss,health_profit_loss_period,health_status,health_consecutive_losses,health_warning_flags,catalyst_score,has_dividend,dividend_amount,has_bonus,bonus_ratio,correction_detected,correction_pct,reversal_confirmed,correction_confidence,oversold_score,fundamental_confidence,catalyst_strength,boost_applied,boost_tier,correction_reasoning,risk_filters_passed,risk_violations,market_context,market_vix_level,supervisor_verdict,supervisor_confidence,supervision_notes,headline,reasoning
1,IRB,IRB INFRASTRUCTURE DEVELOPERS LIMITED,79.0,bullish,BUY,"earnings, investment, contract",FX/currency risk,54,2,46.7,44.54,2025-11-17T08:13:24.139929,43.87,44.76,45.65,46.77,43.43,+13.03,41.01,969.74,9.73,1.04,TRUE,TRUE,healthy,,,,,,,5,TRUE,₹0.1,FALSE,,FALSE,,FALSE,,,,,,,Correction detection failed: Outside valid range: 8.5% (need 10-35%),,,,,CAUTION,0.50,⚠️  Decision flagged for caution review | Issues: Reversal confirmation failed - critical layer | Re,"IRB Infra Developers stock climbs 7% as firm bags ₹9,270 cr project from NHAI","Detected 3 catalyst(s). Risks: FX/currency risk. Evidence: FX/currency risk: IRB Infra Developers stock climbs 7% as firm bags ₹9,270 cr project from NHAI IRB Infra Developers stock climbs 7% as firm "
2,SUZLON,SUZLON ENERGY LIMITED,74.5,bullish,ACCUMULATE,"earnings, investment, expansion","Regulatory/probe risk, FX/currency risk",48,1,48.6,57.70,2025-11-17T08:50:56.773434,56.83,57.99,59.14,60.59,56.26,+8.68,7.29,213.72,10.40,0.12,TRUE,TRUE,healthy,,,,,,,0,FALSE,,FALSE,,TRUE,14.1%,FALSE,0.21,20.0,50.0,0.0,,,Adjusted confidence 0.21 below requirement 0.30,TRUE,,uncertain,0.5,CAUTION,0.50,⚠️  Decision flagged for caution review | Issues: Low correction confidence: 0.21 | Recommendation: ,"Motilal’s stocks to buy post Q2: Suzlon, Airtel, Adani Ports offer up to 28% return potential ","Detected 3 catalyst(s). Risks: Regulatory/probe risk, FX/currency risk. Evidence: FX/currency risk: Motilal’s stocks to buy post Q2: Suzlon, Airtel, Adani Ports offer up to 28% return potential Motila"
3,RELIANCE,RELIANCE INDUSTRIES LIMITED,68.8,neutral,ACCUMULATE,"earnings, investment, expansion","Regulatory/probe risk, FX/currency risk",54,1,52.8,1518.30,2025-11-17T08:50:03.957885,1495.53,1525.89,1556.26,1594.21,1480.34,+12.46,78.32,0.04,11.08,0.44,TRUE,TRUE,healthy,,,,,,,5,TRUE,₹5.5,FALSE,,FALSE,,FALSE,,,,,,,Correction detection failed: Outside valid range: 0.0% (need 10-35%),,,,,CAUTION,0.50,⚠️  Decision flagged for caution review | Issues: Reversal confirmation failed - critical layer | Re,Bitcoin falls 10% in one week as extreme fear grips markets; crypto market sheds $1.1 trillion in 41,"Detected 3 catalyst(s). Risks: Regulatory/probe risk, FX/currency risk. Evidence: FX/currency risk: Bitcoin falls 10% in one week as extreme fear grips markets; crypto market sheds $1.1 trillion in 41"
4,WORTH,WORTH PERIPHERALS LIMITED,63.1,bullish,BUY,investment,FX/currency risk,66,1,39.9,159.00,2025-11-17T08:44:49.891098,156.62,159.79,162.97,166.95,155.03,+2.25,,-2.82,7.22,0.11,TRUE,TRUE,moderate,,,,,,,0,FALSE,,FALSE,,TRUE,13.3%,FALSE,,,,,,,Stock showing correction but reversal signals insufficient: 0 technical signal(s),,,,,CAUTION,0.50,⚠️  Decision flagged for caution review | Issues: Reversal confirmation failed - critical layer | Re,"Govt greenlights 17 projects worth ₹7,172 crore under Electronics Component Manufacturing Scheme","Detected 1 catalyst(s). Risks: FX/currency risk. Evidence: FX/currency risk: Govt greenlights 17 projects worth ₹7,172 crore under Electronics Component Manufacturing Scheme Govt greenlights 17 projec"
5,HONASA,HONASA CONSUMER LIMITED,61.2,bullish,WATCH,"earnings, investment, expansion",Regulatory/probe risk,57,1,59.5,298.85,2025-11-17T08:11:10.555758,294.37,300.34,306.32,313.79,291.38,+5.22,311.18,-35.00,7.29,0.12,TRUE,TRUE,moderate,,,,,,,0,FALSE,,FALSE,,FALSE,,FALSE,,,,,,,Correction detection failed: Outside valid range: 2.4% (need 10-35%),,,,,CAUTION,0.50,⚠️  Decision flagged for caution review | Issues: Reversal confirmation failed - critical layer | Re,Mamaearth glows with 47% rally as Honasa hits reset after a 64% crash. Is an IPO-price comeback next,Detected 3 catalyst(s). Risks: Regulatory/probe risk. Evidence: Regulatory/probe risk: Mamaearth glows with 47% rally as Honasa hits reset after a 64% crash.. From economictimes.indiatimes.com [tier1:
6,SPIC,SOUTHERN PETROCHEMICALS INDUSTRIES CORPORATION  LIMITED,60.7,bullish,WATCH,earnings,FX/currency risk,74,1,50.2,92.27,2025-11-17T08:37:33.418223,90.89,92.73,94.58,96.88,89.96,+11.29,6.65,37.64,8.58,0.60,TRUE,TRUE,healthy,,,,,,,5,TRUE,₹2.0,FALSE,,TRUE,23.4%,FALSE,0.19,20.0,43.0,0.0,,,Adjusted confidence 0.19 below requirement 0.30,TRUE,,uncertain,0.5,CAUTION,0.50,⚠️  Decision flagged for caution review | Issues: Low correction confidence: 0.19 | Recommendation: ,SPIC sees nearly 74% jump in Q2 PAT of ₹61 crore,Detected 1 catalyst(s). Risks: FX/currency risk. Evidence: FX/currency risk: SPIC sees nearly 74% jump in Q2 PAT of ₹61 crore SPIC sees nearly 74% jump in Q2 PAT of ₹61 crore - The HinduBusinessLine S
7,RETAIL,JHS SVENDGAARD RETAIL VENTURES LIMITED,51.4,bullish,WATCH,"earnings, investment",FX/currency risk,66,2,37.1,30.10,2025-11-17T07:49:05.779064,29.80,30.10,31.30,32.51,28.90,-10.00,-156.66,-53.89,-1.66,0.44,FALSE,TRUE,concerning,,,,,,,0,FALSE,,FALSE,,TRUE,30.1%,FALSE,,,,,,,Stock showing correction but reversal signals insufficient: 0 technical signal(s),,,,,CAUTION,0.50,⚠️  Decision flagged for caution review | Issues: Reversal confirmation failed - critical layer | Re,Praxis Home Retail posts ₹81 crore Q2 profit after turnaround,Detected 2 catalyst(s). Risks: FX/currency risk. Evidence: FX/currency risk: Praxis Home Retail posts ₹81 crore Q2 profit after turnaround Praxis Home Retail posts ₹81 crore Q2 profit after turnaround
8,BRIGADE,BRIGADE ENTERPRISES LIMITED,43.9,neutral,WATCH,,FX/currency risk,48,1,36.8,945.40,2025-11-17T07:58:35.798685,931.22,950.13,969.03,992.67,921.76,+11.84,79.03,51.85,11.70,1.06,TRUE,TRUE,healthy,,,,,,,5,TRUE,₹2.5,FALSE,,TRUE,16.2%,FALSE,0.36,75.0,45.0,0.0,,,Confidence below minimum,TRUE,,uncertain,0.5,CAUTION,0.60,⚠️  Decision flagged for caution review | Issues: Low correction confidence: 0.36 | Recommendation: ,Jaguar Land Rover inks fresh 1.46 lakh sq ft in Bengaluru's Brigade Tech Park,Detected 0 catalyst(s). Risks: FX/currency risk. Evidence: FX/currency risk: Jaguar Land Rover inks fresh 1.46 lakh sq ft in Bengaluru's Brigade Tech Park Jaguar Land Rover inks fresh 1.46 lakh sq ft 
9,PRAXIS,PRAXIS HOME RETAIL LIMITED,43.4,bullish,WATCH,"earnings, investment",FX/currency risk,66,1,46.2,11.52,2025-11-17T07:31:02.543738,11.40,11.52,11.98,12.44,11.06,-9.86,-69.88,59.19,-70.07,-4.12,FALSE,FALSE,concerning,,,,,,,0,FALSE,,FALSE,,TRUE,18.3%,FALSE,,,,,,,Stock showing correction but reversal signals insufficient: 0 technical signal(s),,,,,CAUTION,0.50,⚠️  Decision flagged for caution review | Issues: Reversal confirmation failed - critical layer | Re,Praxis Home Retail posts ₹81 crore Q2 profit after turnaround,Detected 2 catalyst(s). Risks: FX/currency risk. Evidence: FX/currency risk: Praxis Home Retail posts ₹81 crore Q2 profit after turnaround Praxis Home Retail posts ₹81 crore Q2 profit after turnaround
