rank,ticker,company_name,ai_score,sentiment,recommendation,catalysts,risks,certainty,articles_count,quant_alpha,current_price,price_timestamp,entry_zone_low,entry_zone_high,target_conservative,target_aggressive,stop_loss,fundamental_adjustment,quarterly_earnings_growth_yoy,annual_earnings_growth_yoy,profit_margin_pct,debt_to_equity,is_profitable,net_worth_positive,financial_health_status,health_is_profitable,health_profit_loss,health_profit_loss_period,health_status,health_consecutive_losses,health_warning_flags,catalyst_score,has_dividend,dividend_amount,has_bonus,bonus_ratio,correction_detected,correction_pct,reversal_confirmed,correction_confidence,oversold_score,fundamental_confidence,catalyst_strength,boost_applied,boost_tier,correction_reasoning,risk_filters_passed,risk_violations,market_context,market_vix_level,supervisor_verdict,supervisor_confidence,supervision_notes,headline,reasoning
1,BANKINDIA,BANK OF INDIA,80.2,bullish,ACCUMULATE,"earnings, investment, expansion","Regulatory/probe risk, FX/currency risk",84,1,58.6,146.52,2025-11-15T08:17:19.872930,144.32,147.25,150.18,153.85,142.86,+6.98,-3.11,45.45,21.89,1.16,TRUE,TRUE,moderate,TRUE,,unknown,healthy,0,,5,TRUE,₹4.0,FALSE,,FALSE,,FALSE,,,,,,,Correction detection failed: Outside valid range: 0.1% (need 10-35%),,,,,CAUTION,0.50,⚠️  Decision flagged for caution review | Issues: Reversal confirmation failed - critical layer | Re,FIIs and DIIs place big bets on State Bank of India — Analysts see about 20% rally ahead ,"Detected 3 catalyst(s). Risks: Regulatory/probe risk, FX/currency risk. Evidence: Regulatory/probe risk: FIIs and DIIs place big bets on State Bank of India — Analysts see about 20% rally ahead FIIs a"
2,SBIN,STATE BANK OF INDIA,77.7,bullish,ACCUMULATE,"earnings, investment, expansion","Regulatory/probe risk, FX/currency risk",84,1,56.5,967.85,2025-11-15T08:26:28.114925,953.33,972.69,992.05,1016.24,943.65,+4.50,9.71,15.62,23.90,1.27,,TRUE,healthy,,,unknown,critical,None,ZERO_DATA_POINTS_COLLECTED; CANNOT_VERIFY_PROFITABILITY; CANNOT_ASSESS_REVENUE_TRENDS; CANNOT_EVALUATE_DEBT_LEVELS; CANNOT_DETERMINE_LOSS_QUARTERS; DATA_COLLECTION_SYSTEM_FAILURE; IMPOSSIBLE_TO_ASSESS_INVESTMENT_RISK,0,FALSE,,FALSE,,FALSE,,FALSE,,,,,,,Correction detection failed: Outside valid range: 0.0% (need 10-35%),,,,,CAUTION,0.50,⚠️  Decision flagged for caution review | Issues: Reversal confirmation failed - critical layer | Re,FIIs and DIIs place big bets on State Bank of India — Analysts see about 20% rally ahead ,"Detected 3 catalyst(s). Risks: Regulatory/probe risk, FX/currency risk. Evidence: FX/currency risk: FIIs and DIIs place big bets on State Bank of India — Analysts see about 20% rally ahead FIIs and DI"
3,IRB,IRB INFRASTRUCTURE DEVELOPERS LIMITED,77.7,bullish,BUY,"earnings, investment, contract",FX/currency risk,62,1,40.5,42.96,2025-11-15T07:44:24.029312,42.32,43.17,44.03,45.11,41.89,+13.03,41.01,969.74,9.73,1.04,,TRUE,healthy,,,unknown,critical,None,ZERO_DATA_POINTS_COLLECTED; COMPLETE_DATA_COLLECTION_FAILURE; ANALYSIS_IMPOSSIBLE; UNKNOWN_PROFITABILITY_STATUS; UNKNOWN_REVENUE_TRENDS; NO_QUARTERLY_RESULTS; NO_BALANCE_SHEET_DATA; POTENTIAL_INVALID_TICKER; DATA_CONSISTENCY_ZERO,5,TRUE,,FALSE,,TRUE,13.0%,FALSE,0.30,55.0,45.0,0.0,,,Confidence below minimum,TRUE,,uncertain,0.5,CAUTION,0.60,⚠️  Decision flagged for caution review | Issues: Low correction confidence: 0.30 | Recommendation: ,"IRB Infrastructure Trust bags TOT project from NHAI in UP for upfront ₹9,270 cr","Detected 3 catalyst(s). Risks: FX/currency risk. Evidence: FX/currency risk: IRB Infrastructure Trust bags TOT project from NHAI in UP for upfront ₹9,270 cr IRB Infrastructure Trust bags TOT project f"
4,SIEMENS,SIEMENS LIMITED,69.9,neutral,STRONG BUY,"earnings, investment, contract",FX/currency risk,74,1,54.6,3084.20,2025-11-15T08:27:26.017891,3053.36,3084.20,3207.57,3330.94,2960.83,+2.77,-26.80,38.54,9.73,0.02,FALSE,TRUE,moderate,FALSE,,unknown,healthy,0,,0,FALSE,,FALSE,,FALSE,,FALSE,,,,,,,Correction detection failed: Outside valid range: 7.3% (need 10-35%),,,,,CAUTION,0.50,⚠️  Decision flagged for caution review | Issues: Reversal confirmation failed - critical layer | Re,Siemens Sept qtr net profit falls 7% to ₹485 cr,Detected 3 catalyst(s). Risks: FX/currency risk. Evidence: FX/currency risk: Siemens Sept qtr net profit falls 7% to ₹485 cr Siemens Sept qtr net profit falls 7% to ₹485 cr - The HinduBusinessLine SEN
5,BLACKBUCK,ZINKA LOGISTICS SOLUTIONS LIMITED,66.8,bullish,WATCH,"earnings, investment, expansion","Regulatory/probe risk, FX/currency risk",57,1,59.8,699.00,2025-11-15T07:27:46.966014,692.01,699.00,726.96,754.92,671.04,+9.86,110.83,95.54,19.32,0.03,,TRUE,healthy,,,unknown,critical,None,ZERO_DATA_RECEIVED; COMPLETE_ANALYSIS_FAILURE; DATA_COLLECTION_PIPELINE_ERROR; CANNOT_VERIFY_COMPANY_STATUS; UNKNOWN_PROFITABILITY; UNKNOWN_REVENUE_TRENDS; NO_FINANCIAL_METRICS_AVAILABLE; POTENTIAL_DELISTING_OR_SUSPENSION; TICKER_SYMBOL_VERIFICATION_NEEDED; INVESTMENT_DECISION_IMPOSSIBLE,0,FALSE,,FALSE,,FALSE,,FALSE,,,,,,,Correction detection failed: Outside valid range: 4.7% (need 10-35%),,,,,CAUTION,0.50,⚠️  Decision flagged for caution review | Issues: Reversal confirmation failed - critical layer | Re,"BlackBuck gets Buy rating as Ambit sees strong growth ahead, values stock at Rs 885 ","Detected 3 catalyst(s). Risks: Regulatory/probe risk, FX/currency risk. Evidence: Regulatory/probe risk: BlackBuck gets Buy rating as Ambit sees strong growth ahead, values stock at Rs 885 BlackBuck g"
6,WORTH,WORTH PERIPHERALS LIMITED,65.8,neutral,ACCUMULATE,"earnings, investment, expansion","Regulatory/probe risk, FX/currency risk",48,3,41.5,159.00,2025-11-15T08:15:02.003228,156.62,159.79,162.97,166.95,155.03,+2.25,,-2.82,7.22,0.11,,TRUE,moderate,,,unknown,critical,None,ZERO_DATA_POINTS_AVAILABLE; CANNOT_VERIFY_COMPANY_EXISTS; NO_PROFITABILITY_DATA; NO_REVENUE_DATA; NO_QUARTERLY_RESULTS; COMPLETE_INFORMATION_BLACKOUT; POTENTIAL_INVALID_TICKER; DATA_COLLECTION_SYSTEM_FAILURE,0,FALSE,,FALSE,,TRUE,13.3%,FALSE,,,,,,,Stock showing correction but reversal signals insufficient: 0 technical signal(s),,,,,CAUTION,0.50,⚠️  Decision flagged for caution review | Issues: Reversal confirmation failed - critical layer | Re,CII Partnership Summit 2025: AP inked investment deals worth ₹13 lakh crore: CM Naidu,"Detected 3 catalyst(s). Risks: Regulatory/probe risk, FX/currency risk. Evidence: FX/currency risk: CII Partnership Summit 2025: AP inked investment deals worth ₹13 lakh crore: CM Naidu CII Partnershi"
7,MARICO,MARICO LIMITED,65.5,neutral,ACCUMULATE,earnings,FX/currency risk,78,1,66.9,738.70,2025-11-15T08:23:11.898714,731.31,738.70,768.25,797.80,709.15,+10.88,8.62,9.99,15.46,0.14,FALSE,TRUE,healthy,FALSE,,unknown,healthy,0,,5,TRUE,₹7.0,FALSE,,FALSE,,FALSE,,,,,,,Correction detection failed: Outside valid range: 1.7% (need 10-35%),,,,,CAUTION,0.50,⚠️  Decision flagged for caution review | Issues: Reversal confirmation failed - critical layer | Re,"Marico’s profit declines 0.7% in Q2 FY26, to ₹420 crore","Detected 1 catalyst(s). Risks: FX/currency risk. Evidence: FX/currency risk: Marico’s profit declines 0.7% in Q2 FY26, to ₹420 crore Marico’s profit declines 0.7% in Q2 FY26, to ₹420 crore - The Hindu"
8,INDIGO,INTERGLOBE AVIATION LIMITED,52.0,neutral,ACCUMULATE,"investment, expansion","Regulatory/probe risk, FX/currency risk",58,1,42.1,5908.50,2025-11-15T08:21:26.631453,5819.87,5938.04,6056.21,6203.93,5760.79,-2.29,-20.25,-11.19,10.62,7.13,,TRUE,concerning,,,unknown,critical,None,ZERO_DATA_POINTS_COLLECTED; COMPLETE_DATA_COLLECTION_FAILURE; TICKER_SYMBOL_VERIFICATION_REQUIRED; CANNOT_VERIFY_COMPANY_STATUS; CANNOT_ASSESS_PROFITABILITY; CANNOT_ASSESS_REVENUE_TRENDS; CANNOT_ASSESS_FINANCIAL_HEALTH; SYSTEM_MALFUNCTION_SUSPECTED; POTENTIAL_DELISTING_OR_SUSPENSION; API_FAILURE_OR_RATE_LIMIT_EXCEEDED,5,TRUE,₹10.0,FALSE,,FALSE,,FALSE,,,,,,,Correction detection failed: Outside valid range: 4.0% (need 10-35%),,,,,CAUTION,0.50,⚠️  Decision flagged for caution review | Issues: Reversal confirmation failed - critical layer | Re,IndiGo fuels domestic expansion with new routes from newly launched Navi Mumbai International Airpor,"Detected 2 catalyst(s). Risks: Regulatory/probe risk, FX/currency risk. Evidence: Regulatory/probe risk: IndiGo fuels domestic expansion with new routes from newly launched Navi Mumbai International A"
9,IDEAFORGE,IDEAFORGE TECHNOLOGY LIMITED,51.6,bullish,BUY,"investment, contract",FX/currency risk,66,1,43.2,464.65,2025-11-15T07:41:31.424754,457.68,466.97,476.27,487.88,453.03,-12.10,-2106.47,-237.58,-184.32,0.03,,TRUE,concerning,,,unknown,critical,0,ZERO_DATA_COLLECTED; NO_FINANCIAL_METRICS_AVAILABLE; COLLECTOR_SYSTEM_FAILURE; AI_CLIENT_NOT_CONFIGURED; CANNOT_DETERMINE_PROFITABILITY; CANNOT_ASSESS_RISK,0,FALSE,,FALSE,,TRUE,21.1%,FALSE,0.24,55.0,25.0,0.0,,,Stock fails risk management criteria: High volatility (beta 1.7) + low confidence,FALSE,volatility,,,CAUTION,0.50,⚠️  Decision flagged for caution review | Issues: Risk filters failed | Recommendation: Verify or re,ideaForge Tech bags ₹100-cr supply order from Indian Army,Detected 2 catalyst(s). Risks: FX/currency risk. Evidence: FX/currency risk: ideaForge Tech bags ₹100-cr supply order from Indian Army ideaForge Tech bags ₹100-cr supply order from Indian Army - The H
