rank,ticker,company_name,ai_score,sentiment,recommendation,catalysts,risks,certainty,articles_count,quant_alpha,current_price,price_timestamp,entry_zone_low,entry_zone_high,target_conservative,target_aggressive,stop_loss,fundamental_adjustment,quarterly_earnings_growth_yoy,annual_earnings_growth_yoy,profit_margin_pct,debt_to_equity,is_profitable,net_worth_positive,financial_health_status,health_is_profitable,health_profit_loss,health_profit_loss_period,health_status,health_consecutive_losses,health_warning_flags,catalyst_score,has_dividend,dividend_amount,has_bonus,bonus_ratio,correction_detected,correction_pct,reversal_confirmed,correction_confidence,oversold_score,fundamental_confidence,catalyst_strength,boost_applied,boost_tier,correction_reasoning,risk_filters_passed,risk_violations,market_context,market_vix_level,supervisor_verdict,supervisor_confidence,supervision_notes,headline,reasoning
1,APOLLO,APOLLO MICRO SYSTEMS LIMITED,85.9,bullish,ACCUMULATE,"earnings, investment, expansion","Regulatory/probe risk, FX/currency risk",82,1,43.5,284.35,2025-11-16T19:34:59.581533,280.08,285.77,291.46,298.57,277.24,+14.84,119.58,81.23,13.86,0.55,TRUE,TRUE,healthy,,,,,,,5,TRUE,,FALSE,,FALSE,17.6%,FALSE,,,,,,,"Pullback detected but failed confirmation checks: Decline streak 4d (need 5+), volume 0.85x",,,,,CAUTION,0.50,⚠️  Decision flagged for caution review | Issues: Reversal confirmation failed - critical layer | Re,Apollo Hospital Share Price Live Updates: Negative returns reported by Apollo Hospital ,"Detected 3 catalyst(s). Risks: Regulatory/probe risk, FX/currency risk. Evidence: FX/currency risk: Apollo Hospital Share Price Live Updates: Negative returns reported by Apollo Hospital Apollo Hospit"
2,BSE,BSE LIMITED,82.8,bullish,ACCUMULATE,"earnings, investment, expansion","Regulatory/probe risk, FX/currency risk",57,1,64.1,2812.20,2025-11-16T20:33:56.855967,2770.02,2826.26,2882.50,2952.81,2741.89,+18.20,61.05,70.34,52.27,0.00,TRUE,TRUE,healthy,,,,,,,10,FALSE,,TRUE,2:1,FALSE,,FALSE,,,,,,,Correction detection failed: Outside valid range: 0.5% (need 10-35%),,,,,CAUTION,0.50,⚠️  Decision flagged for caution review | Issues: Reversal confirmation failed - critical layer | Re,"From Ola to BSE and Tata stocks: Retail investors bet Rs 18,000 crore on these 10 stocks ","Detected 3 catalyst(s). Risks: Regulatory/probe risk, FX/currency risk. Evidence: FX/currency risk: From Ola to BSE and Tata stocks: Retail investors bet Rs 18,000 crore on these 10 stocks From Ola to"
3,TITAN,TITAN COMPANY LIMITED,67.4,bullish,ACCUMULATE,"investment, expansion","Regulatory/probe risk, FX/currency risk",56,1,53.8,3840.50,2025-11-16T20:38:20.174627,3782.89,3859.70,3936.51,4032.53,3744.49,+7.54,52.59,-4.55,7.36,1.79,TRUE,TRUE,moderate,,,,,,,5,TRUE,₹11.0,FALSE,,FALSE,,FALSE,,,,,,,Correction detection failed: Outside valid range: 0.3% (need 10-35%),,,,,CAUTION,0.50,⚠️  Decision flagged for caution review | Issues: Reversal confirmation failed - critical layer | Re,Titan Intech to invest ₹250 crore in integrated display electronics facility,"Detected 2 catalyst(s). Risks: Regulatory/probe risk, FX/currency risk. Evidence: Regulatory/probe risk: Titan Intech to invest ₹250 crore in integrated display electronics facility Titan Intech to in"
4,PARAS,PARAS DEFENCE AND SPACE TECHNOLOGIES LIMITED,57.8,bullish,WATCH,,FX/currency risk,55,1,66.6,774.00,2025-11-16T19:38:19.657001,762.39,777.87,793.35,812.70,754.65,+15.14,0.13,97.98,15.96,0.04,TRUE,TRUE,healthy,,,,,,,8,TRUE,,FALSE,,FALSE,,FALSE,,,,,,,Correction detection failed: Outside valid range: 8.9% (need 10-35%),,,,,CAUTION,0.50,⚠️  Decision flagged for caution review | Issues: Reversal confirmation failed - critical layer | Re,Stock to buy today: Paras Defence & Space Technologies (₹766) – BUY,Detected 0 catalyst(s). Risks: FX/currency risk. Evidence: FX/currency risk: Stock to buy today: Paras Defence & Space Technologies (₹766) – BUY Stock to buy today: Paras Defence &amp; Space Technolog
5,HUDCO,HOUSING & URBAN DEVELOPMENT CORPORATION LIMITED,56.6,bullish,BUY,investment,FX/currency risk,55,1,43.3,231.92,2025-11-16T20:35:21.308642,228.44,233.08,237.72,243.52,226.12,+5.34,3.08,27.99,68.36,5.97,TRUE,TRUE,moderate,,,,,,,5,TRUE,,FALSE,,FALSE,,FALSE,,,,,,,Correction detection failed: Outside valid range: 3.4% (need 10-35%),,,,,CAUTION,0.50,⚠️  Decision flagged for caution review | Issues: Reversal confirmation failed - critical layer | Re,Hudco in talks with global development institutions to raise $1 billion by March: CMD,Detected 1 catalyst(s). Risks: FX/currency risk. Evidence: FX/currency risk: Hudco in talks with global development institutions to raise $1 billion by March: CMD Hudco in talks with global developmen
6,IDEAFORGE,IDEAFORGE TECHNOLOGY LIMITED,55.9,bullish,ACCUMULATE,"earnings, m&a, investment, expansion, contract","Regulatory/probe risk, FX/currency risk",74,1,41.9,508.70,2025-11-16T20:00:44.572954,501.07,511.24,521.42,534.13,495.98,-12.10,-2106.47,-237.58,-184.32,0.03,FALSE,TRUE,concerning,,,,,,,0,FALSE,,FALSE,,TRUE,13.7%,FALSE,0.14,20.0,25.0,0.0,,,Stock fails risk management criteria: High volatility (beta 1.7) + low confidence,FALSE,volatility,,,CAUTION,0.50,⚠️  Decision flagged for caution review | Issues: Risk filters failed | Recommendation: Verify or re,Ideaforge Technology shares in focus as co lands over Rs 100 crore in defence orders ,"Detected 5 catalyst(s). Risks: Regulatory/probe risk, FX/currency risk. Evidence: Regulatory/probe risk: Ideaforge Technology shares in focus as co lands over Rs 100 crore in defence orders Ideaforge "
